classifier_prob	classifier_judgement	true_label	sentence_1	sentence_2	Index	Flag	Idiom
0.5780285596847534	1	1	Leave it to the baby boomers to take a world where one could pay for college by working a part time summer job, and turn it into a world where two parents with full time jobs can't make ends meet	Leave it to the baby boomers to take a world where one could pay for college by working a part time summer job, and turn it into a world where two parents with full time jobs can't earn enough	416	0	make ends meet
0.3042333126068115	0	0	For some time, I ordered cheap keyboards by the case because I knew it was only a matter of time until I got pissed off and would start throwing the thing around	For some time, I ordered cheap keyboards by the case because I knew it was only a concern of case until I got pissed off and would start throwing the thing around	153	0	matter of time
0.9605149030685425	1	1	What is the most logical thing to do? Why run down the road away from them of course!! This leads to another movie issue	What is the most logical thing to do? Why run someday away from them of course!! This leads to another movie issue	9	0	down the road
0.3778587579727173	0	0	It helps them get the picture	It helps them buy the picture	384	1	get the picture
0.5485881567001343	1	1	Obviously 30 IP won't break the bank, but the problem with tier 1 runes is that you'll never touch them again once you can get tier 3, and you can't get your money back	Obviously 30 IP won't get all the money, but the problem with tier 1 runes is that you'll never touch them again once you can get tier 3, and you can't get your money back	67	0	break the bank
0.7616050839424133	1	1	There must be something going on behind the scenes, like the publishers paying off the colleges for always requireing the latest edition or something	There must be something going on secretly, like the publishers paying off the colleges for always requireing the latest edition or something	430	0	behind the scenes
-0.029924750328063965	0	0	I just got flashbacks from when I came face to face with one in front of my apartment	I just got flashbacks from when I came skull to skull with one in front of my apartment	335	1	face to face
0.1987091302871704	0	0	It's called tit for tat	It's called nipple for cheapness	3	0	tit for tat
0.16379326581954956	0	0	Well, they say fight fire with fire(arms)	Well, they say combat flame with flame(arms)	22	0	fight fire with fire
0.3061926066875458	0	0	Something along the lines of "meat is made out of animals	Something next to the lines of "meat is made out of animals	272	1	along the lines
0.08711305260658264	0	0	And if you squash that hope in the same breath that you are telling her that you love her, that's just plain mean	And if you squash that hope in the same inhale that you are telling her that you love her, that's just plain mean	453	0	in the same breath
0.14234206080436707	0	0	When I first posted the link here it started popping up all over the place it was on CBS	When I first posted the link here it started popping up all over the point it was on CBS	418	0	all over the place
0.0992388129234314	0	0	The kind you felt when you had nothing to stress about, not even day to day things like putting food on the table, work and other obligations	The kind you felt when you had nothing to stress about, not even day to day things like putting food on the coffee table, work and other obligations	480	0	put food on the table
1.0324382781982422	1	1	good to see racism is alive and kicking	good to see racism is still active	385	1	alive and kicking
0.4475105106830597	0	1	and before any douchebag comes in with the old tit for tat logical failure, I'm well aware how fucked my country is right now	and before any douchebag comes in with the old tooth for toooth logical failure, I'm well aware how fucked my country is right now	131	0	tit for tat
1.1016294956207275	1	1	That's got to be a giant fucking slap in the face	That's got to be a giant fucking attack	93	0	slap in the face
0.07419982552528381	0	0	I am very interested in discussing these ideas because, to be perfectly honest with you, I think a good deal of them make a lot of sense	I am very interested in discussing these ideas because, to be perfectly honest with you, I think a good arms deal of them make a lot of sense	97	0	a good deal
0.5943730473518372	1	1	i love Grant Morrison for putting him front and center on his JLA run	i love Grant Morrison for putting him in the light on his JLA run	156	0	front and center
-0.14943647384643555	0	0	They are putting on a show, because behind the scenes, they are all friends	They are putting on a show, because behind the darkness, they are all friends	133	0	behind the scenes
-0.008809000253677368	0	0	The people of Japan **cannot** let these crimes go unpunished from TEPCO, the IAEA, and right up the Naoto Kan and many other behind the scenes folks	The people of Japan **cannot** let these crimes go unpunished from TEPCO, the IAEA, and right up the Naoto Kan and many other behind the darkness folks	56	0	behind the scenes
0.8799048662185669	1	1	From what i've heard, you learn to 'read' the other person's actions that lead up to them throwing a punch	From what i've heard, you learn to 'read' the other person's actions that caused them throwing a punch	114	0	lead up to
0.5382375121116638	1	1	Compare 8g of thorium (once it's being mined and refined on a scale to support general vehicle use) to 7500 gal of gasoline at the prices anticipated for 2014 (when the prototype is expected to be up and running)	Compare 8g of thorium (once it's being mined and refined on a scale to support general vehicle use) to 7500 gal of gasoline at the prices anticipated for 2014 (when the prototype is expected to be developed)	86	0	up and running
0.6210541725158691	1	1	It will probably make America’s long-run deficit problem worse, not better; and most important, by demonstrating that raw extortion works and carries no political cost, it will take America a long way down the road to banana-republic status	It will probably make America’s long-run deficit problem worse, not better; and most important, by demonstrating that raw extortion works and carries no political cost, it will take America a long way in the future to banana-republic status	470	0	down the road
0.7408034205436707	1	1	You've played before and I'm sure you're smart enough to get the hang of the new game types (except Medieval Mode perhaps which is a little bit crazy at first)	You've played before and I'm sure you're smart enough to pick up the new game types (except Medieval Mode perhaps which is a little bit crazy at first)	424	0	get the hang of
0.7212607264518738	1	0	aspx?Item=N82E16814161372&amp;cm_sp=Pers_ProductSimilar-_-14-161-372_2_AG-_-14-161-355How do you feel about the card? I plan on buying another down the line and running corssfire/sli	aspx?Item=N82E16814161372&amp;cm_sp=Pers_ProductSimilar-_-14-161-372_2_AG-_-14-161-355How do you feel about the card? I plan on buying another right now and running corssfire/sli	311	1	down the line
0.8647342920303345	1	1	This could be a blessing in disguise, friend	This could be a dream come true, friend	69	0	blessing in disguise
-0.05324697494506836	0	0	I mean, if you enjoy him, by all means play him	I mean, if you enjoy him, by all implementations play him	463	0	by all means
1.2343400716781616	1	1	Your local county or city governmental bodies are the ones who nickel and dime you and force strange rules like these upon you	Your local county or city governmental bodies are the ones who tax you unfairly and force strange rules like these upon you	312	1	nickel and dime
0.3092465102672577	0	0	Essentially, the non-monogomous relationships are happening whether they are admitted to or not, it's then swept under the rug by the offending party being dishonest with their SO until found out, and then both parties often remaining dishonest with the world to avoid scandal while trying to figure out how to reconfigure their relationship	Essentially, the non-monogomous relationships are happening whether they are admitted to or not, it's then swept under the floor cover by the offending party being dishonest with their SO until found out, and then both parties often remaining dishonest with the world to avoid scandal while trying to figure out how to reconfigure their relationship	192	0	under the rug
1.1085562705993652	1	1	That;s what I was thinking, I mean you wouldn't bother posting the dime a dozen monsters, it's the hot ones that get the attention	That;s what I was thinking, I mean you wouldn't bother posting the ordinary monsters, it's the hot ones that get the attention	151	0	dime a dozen
0.5194678902626038	1	0	Thats when I wake up in a jolt with my heart rate through the roof hoping I'm actually awake, not dreaming I'm awake	Thats when I wake up in a jolt with my heart rate unchanged hoping I'm actually awake, not dreaming I'm awake	261	1	through the roof
0.2534596025943756	0	0	Im going to attempt to have a go at doing what I can to it for the next week, its been one of those 'never happy with it, so never finished it' projects	Im going to attempt to have a continue at doing what I can to it for the next week, its been one of those 'never happy with it, so never finished it' projects	263	1	have a go
0.7664496898651123	1	1	Hormones are all over the place after you give birth, and lactation hormones in particular are a libido killer	Hormones are common after you give birth, and lactation hormones in particular are a libido killer	477	0	all over the place
0.26271218061447144	0	0	"A challenge to those who are opposed to ""voter ID laws"":If you were to design a voter identity verification system, from the ground up, completely from scratch, how would you do it?  It seems difficult to imagine any robust voter identity verification system that would NOT utilize a government-issued ID in some way"	"A challenge to those who are opposed to ""voter ID laws"":If you were to design a voter identity verification system, from the object up, completely from scratch, how would you do it?  It seems difficult to imagine any robust voter identity verification system that would NOT utilize a government-issued ID in some way"	106	0	from the ground up
0.7086853981018066	1	1	While this Twitter feed fails to mention an (alleged?) assault, UK laws do seem a bit strange (and maybe restrictive) to some of us across the pond	While this Twitter feed fails to mention an (alleged?) assault, UK laws do seem a bit strange (and maybe restrictive) to some of us in the US	180	0	across the pond
1.047544002532959	1	1	Seems like a good deal	Seems like a lot	27	0	a good deal
1.0863492488861084	1	1	We love our surname and it suits us to a T	We love our surname and it suits us well	388	1	to a T
-0.06209355592727661	0	0	It's tempting to just skip ahead to the simplified, but trust me, the harder way will be better for you in the long run if you really want to be literate	It's tempting to just skip ahead to the simplified, but trust me, the harder way will be better for you in the long score if you really want to be literate	429	0	in the long run
0.2550334930419922	0	0	sounds like you just described me in a nutshell	sounds like you just described me in a shell	143	0	in a nutshell
0.6990278959274292	1	1	And I know for a fact that said person wouldn't lift a finger to help me in my hour of need, so it's not like I'm losing an ally	And I know for a fact that said person wouldn't do anything to help me in my hour of need, so it's not like I'm losing an ally	251	1	lift a finger
0.25754979252815247	0	0	She wasn't thinking about your best interests when she ended it out of nowhere, so don't think of her best interests	She wasn't thinking about your best interests when she ended it as expected, so don't think of her best interests	256	1	out of nowhere
0.6673701405525208	1	1	The world will never break the cycle of famine and tribal war in places like Somalia without breaking the desperate subsistence economy urge to procreate so that at least some kids survive to be future support for their parents and grandparents	The world will never stop having famine and tribal war in places like Somalia without breaking the desperate subsistence economy urge to procreate so that at least some kids survive to be future support for their parents and grandparents	234	1	break the cycle
0.6690617799758911	1	1	That distance could be physical (moving out), or it could be emotional -- best thing you can do? Stop letting her use your shoulder to cry on	That distance could be physical (moving out), or it could be emotional -- best thing you can do? Stop letting her use as emotional support	271	1	shoulder to cry on
0.7035294771194458	1	1	I think it's kinda funny that the guys who think *I'm* mad and need to calm down are the ones swearing all over the place	I think it's kinda funny that the guys who think *I'm* mad and need to calm down are the ones swearing everywhere	14	0	all over the place
0.5731500387191772	1	0	Our system is more organic with curvy streets running all over the place in every which direction	Our system is more organic with curvy streets running in an ordered fashion in every which direction	331	1	all over the place
1.1961238384246826	1	1	I see fat Brits all over the place	I see fat Brits everywhere	431	0	all over the place
1.0200083255767822	1	1	But for now I'm paying out of pocket	But for now I'm paying from my own share	448	0	out of pocket
0.33535635471343994	0	1	The fact that one is awful and one is less awful only means that people are choosing the lesser of two evils when they could ignore those two choices altogether and choose from a million better things	The fact that one is awful and one is less awful only means that people are choosing the least harmful of two options when they could ignore those two choices altogether and choose from a million better things	434	0	lesser of two evils
0.7416951656341553	1	1	"What part are you having difficulty understanding?  Christians received an *explicit* instruction from Peter--to whom had been given "the keys to the kingdom of heaven" and the rabbinical power to "bind and loose"--that they could eat whatever they wanted	"What part are you having difficulty understanding?  Christians received an *explicit* instruction from Peter--to whom had been made to be the leader and the rabbinical power to "bind and loose"--that they could eat whatever they wanted	387	1	keys to the kingdom
-0.014352798461914062	0	0	"Still makes me go ""holy shit it really is impressive"" from time to time when I see 40 or 50 people running around without being necesarily involved with what I do"	"Still makes me go ""holy shit it really is impressive"" from day to day when I see 40 or 50 people running around without being necesarily involved with what I do"	478	0	from time to time
-0.1810625195503235	0	0	Edit: I meant firstworldproblems that I have and how some people have actual problems and can still be happy and see the light at the end of the tunnel	Edit: I meant firstworldproblems that I have and how some people have actual problems and can still be happy and perceive the actinic radiation at the end of the tunnel	73	0	see the light
-0.055325448513031006	0	0	Non-native birds such as starlings don't need to follow this, and since quality food costs a good deal of money we feed them a more basic food	Non-native birds such as starlings don't need to follow this, and since quality food costs a good bargain deal of money we feed them a more basic food	407	0	a good deal
-0.13191908597946167	0	0	In general it's a good rule of thumb that if it comes right after a preposition, you should probably use "whom"	In general it's a good law of hand that if it comes right after a preposition, you should probably use "whom"	283	1	rule of thumb
0.0367148220539093	0	0	This way, they have a hand in building a new  trust network from the ground up and will probably feel more secure using it	This way, they have a hand in building a new  trust network from the object up and will probably feel more secure using it	119	0	from the ground up
0.727405309677124	1	1	Robinson makes the feel-good argument that we can't possibly classify our unique-snowflake children by age, and then in the same breath lists all the possible alternative ways to classify them	Robinson makes the feel-good argument that we can't possibly classify our unique-snowflake children by age, and then simultaneously lists all the possible alternative ways to classify them	495	0	in the same breath
1.0403552055358887	1	1	He retrained as an anaesthetist and went to work in a big Washington hospital with all the bells and whistles	He retrained as an anaesthetist and went to work in a big Washington hospital with all the best equipment	282	1	bells and whistles
0.022259652614593506	0	0	"The OS, behind the scenes, says ""Okay, the user says he wants to quit this app, but I don't technically *need* to do anything else with the resources it's consuming right now … so I'll just let it keep running with no UI, so it can be restarted quickly"	"The OS, behind the darkness, says ""Okay, the user says he wants to quit this app, but I don't technically *need* to do anything else with the resources it's consuming right now … so I'll just let it keep running with no UI, so it can be restarted quickly"	92	0	behind the scenes
0.7388560771942139	1	1	"The OS, behind the scenes, says ""Okay, the user says he wants to quit this app, but I don't technically *need* to do anything else with the resources it's consuming right now … so I'll just let it keep running with no UI, so it can be restarted quickly"	"The OS, secretly, says ""Okay, the user says he wants to quit this app, but I don't technically *need* to do anything else with the resources it's consuming right now … so I'll just let it keep running with no UI, so it can be restarted quickly"	92	0	behind the scenes
0.08286288380622864	0	0	Here is a good rule of thumb (that I just made up): you shouldn't carry a briefcase unless you are wearing a suit	Here is a good concept of finger (that I just made up): you shouldn't carry a briefcase unless you are wearing a suit	413	0	rule of thumb
0.7170449495315552	1	1	Wenger on the other hand has pretty much had to be CFO and manager and find a way to keep the finances under control after building a stadium that put the club almost £300m in debt	Wenger alternatively has pretty much had to be CFO and manager and find a way to keep the finances under control after building a stadium that put the club almost £300m in debt	462	0	on the other hand
0.6714792251586914	1	1	Lafayette, on the other hand, is one of the more culturally diverse cities I know	On the other hand, Laffayette is one of the more culturally diverse cities I know	270	1	on the other hand
0.908406138420105	1	1	this is true, however, in my experience, if you go to a bank and ask for some leniency in a situation, you will most likely be laughed out the door, credit unions are MUCH more likely to work with you when you fall on hard times	this is true, however, in my experience, if you go to a bank and ask for some leniency in a situation, you will most likely be laughed out the door, credit unions are MUCH more likely to work with you when you aren't doing great	370	1	fall on hard times
0.5918625593185425	1	0	I ended up taking it back to the Apple store and they swapped it out for a new one on the spot because it was under warranty	I ended up taking it back to the Apple store and they swapped it out for a new one later because it was under warranty	213	1	on the spot
0.4356728196144104	0	1	As you can see, looking at the big picture is a large distraction in which helmet-law deniers try and muddy the waters with assumptions, spurious statistical interpretations, irrelevant side issues and unfounded claims	As you can see, looking at the big picture is a large distraction in which helmet-law deniers try and cloud understanding with assumptions, spurious statistical interpretations, irrelevant side issues and unfounded claims	362	1	muddy the waters
1.0140520334243774	1	1	They mostly just go with the flow	They mostly just do what is said	169	0	go with the flow
0.7944671511650085	1	1	If I can get my internet up and running again in time then I'll definitely be on tonight	If I can get my internet functioning reliably again in time then I'll definitely be on tonight	245	1	up and running
0.6384285092353821	1	1	Actually I don't fucking care if you have to punch a wall, or go to the gym to blow off steam	Actually I don't fucking care if you have to punch a wall, or go to the gym to decrease your anger	208	1	blow off steam
0.1620839536190033	0	0	Karma on the other hand was created to be a balance between offense and defense	Karma on the other cheek was created to be a balance between offense and defense	304	1	on the other hand
0.3360355496406555	0	0	"MY teacher apologized as well, but also added a little moral lesson along the lines of ""sometimes life isn't fair, but you should do your best to get through it without complaining"	"MY teacher apologized as well, but also added a little moral lesson along the shapes of ""sometimes life isn't fair, but you should do your best to get through it without complaining"	447	0	along the lines
0.6658496856689453	1	1	The rule of thumb is that if there are 3x the number of players remaining than the number of players who get paid, you ignore the bubble	The main rule is that if there are 3x the number of players remaining than the number of players who get paid, you ignore the bubble	26	0	rule of thumb
0.2324075996875763	0	0	I think it's kinda funny that the guys who think *I'm* mad and need to calm down are the ones swearing all over the place	I think it's kinda funny that the guys who think *I'm* mad and need to calm down are the ones swearing all over the location	14	0	all over the place
-0.2586761713027954	0	0	If a company believes in the power of word of mouth, this is free PR	If a company believes in the power of language unit of lips, this is free PR	157	0	word of mouth
0.6980147361755371	1	1	Further to the above, almost all English-speaking countries, and at a glance almost (if not all) the largest countries in the world use 10^9 as billion	Further to the above, almost all English-speaking countries, and approximately almost (if not all) the largest countries in the world use 10^9 as billion	164	0	at a glance
0.45321282744407654	0	0	The AAV on the other hand is meant to transport marines from the sea to the shore and onward	The AAV on the other leg is meant to transport marines from the sea to the shore and onward	175	0	on the other hand
0.2597338557243347	0	0	Essentially, the non-monogomous relationships are happening whether they are admitted to or not, it's then swept under the rug by the offending party being dishonest with their SO until found out, and then both parties often remaining dishonest with the world to avoid scandal while trying to figure out how to reconfigure their relationship	Essentially, the non-monogomous relationships are happening whether they are admitted to or not, it's then swept under the broadloom by the offending party being dishonest with their SO until found out, and then both parties often remaining dishonest with the world to avoid scandal while trying to figure out how to reconfigure their relationship	192	0	under the rug
0.08091530203819275	0	0	In Iowa, on the other hand, I had a bar client get hit with a $55,000 fine for pulling this shit on their employees who had a dick load of records to back it up; and they ended up having to cough up the cash to pay off their employees + interest	In Iowa, on the different arm, I had a bar client get hit with a $55,000 fine for pulling this shit on their employees who had a dick load of records to back it up; and they ended up having to cough up the cash to pay off their employees + interest	178	0	on the other hand
-0.041056811809539795	0	0	I'd dump AT&T DSL in a heartbeat for them	I'd dump AT&T DSL in a periodic event for them	425	0	in a heartbeat
1.1809179782867432	1	1	Just hoping I don't crash and burn in Geography	Just hoping I don't fail in Geography	366	1	crash and burn
-0.08145630359649658	0	0	I'm going to go out on a limb and guess that you went to a 3rd tier university, correct?	I'm going to go out on a hand and guess that you went to a 3rd tier university, correct?	347	1	go out on a limb
0.8648160696029663	1	1	I read it as it will cost Sony $65 to make a Vita which would leave it in the black around $184, which would be incredible	I read it as it will cost Sony $65 to make a Vita which would leave it rich and wealthy around $184, which would be incredible	183	0	in the black
0.6917109489440918	1	1	aspx?Item=N82E16814161372&amp;cm_sp=Pers_ProductSimilar-_-14-161-372_2_AG-_-14-161-355How do you feel about the card? I plan on buying another down the line and running corssfire/sli	aspx?Item=N82E16814161372&amp;cm_sp=Pers_ProductSimilar-_-14-161-372_2_AG-_-14-161-355How do you feel about the card? I plan on buying another at some point and running corssfire/sli	311	1	down the line
0.408227801322937	0	0	The footnote to that catch being:  We don't know *anything* with 100% certainty, but trying to live a life where absolutely everything is up in the air and not to be trusted is impossible	The footnote to that catch being:  We don't know *anything* with 100% certainty, but trying to live a life where absolutely everything is absolute and not to be trusted is impossible	249	1	up in the air
0.11824533343315125	0	0	Though I still like the weed from time to time	Though I still like the weed from day to day	102	0	from time to time
