classifier_prob	classifier_judgement	true_label	sentence_1	sentence_2	Index	Flag	Idiom
-0.0775943398475647	0	0	And anyway a death by accident would be probabilistically guaranteed in the long run	And anyway a death by accident would be probabilistically guaranteed in the lengthy jog	497	0	in the long run
1.001183032989502	1	1	That's got to be a giant fucking slap in the face	That's got to be a giant fucking criticism	93	0	slap in the face
0.9204410910606384	1	1	&gt; Considering how poorly Israel did against Hezbollah in Lebanon, I doubt fighting Iran would be a walk in the park	&gt; Considering how poorly Israel did against Hezbollah in Lebanon, I doubt fighting Iran would be without difficulty	228	1	walk in the park
0.21108028292655945	0	0	He states something along the lines of "I'll shoot you dead tonight	He states something nearby the lines of "I'll shoot you dead tonight	250	1	along the lines
0.6469658613204956	1	1	i would argue right off the bat that the gil evans collaborations aren't really miles records, and the post "retirement" work should be categorically shunned	I would first argue that the gil evans collaborations aren't really miles records, and the post "retirement" work should be categorically shunned	212	1	off the bat
0.3524942994117737	0	0	Other than that I'm in the clear	Other than that I'm full of problems	367	1	in the clear
0.2147352397441864	0	0	When I think of selfish, mentally unstable, freaky wannabes Nicki Minaj doens't come to mind	When I think of selfish, mentally unstable, freaky wannabes Nicki Minaj doesn't come to body	275	1	come to mind
0.6695041656494141	1	1	This is just a back-door way of a certain political class trying to get their policies enforced above and beyond the will of the people	This is just a back-door way of a certain political class trying to get their policies enforced overcoming the will of the people	104	0	above and beyond
0.24610161781311035	0	0	good to see racism is alive and kicking	good to see racism is alive and walking	385	1	alive and kicking
0.9615482091903687	1	1	I know it's not the same scale, but I've definitely heard them trash-talk a movie, then announce it as one of their sponsors in the same breath	I know it's not the same scale, but I've definitely heard them trash-talk a movie, then announce it as one of their sponsors simultaneously	107	0	in the same breath
0.9656334519386292	1	1	And anyway a death by accident would be probabilistically guaranteed in the long run	And anyway a death by accident would be probabilistically guaranteed in the distant future	497	0	in the long run
0.6194581985473633	1	1	6 remake with better graphics in a heartbeat	6 remake with better graphics in a blink of an eye	99	0	in a heartbeat
0.8935995697975159	1	1	When I think of selfish, mentally unstable, freaky wannabes Nicki Minaj doens't come to mind	When I think of selfish, mentally unstable, freaky wannabes Nicki Minaj is not an example	275	1	come to mind
0.06060260534286499	0	0	Edit: I meant firstworldproblems that I have and how some people have actual problems and can still be happy and see the light at the end of the tunnel	Edit: I meant firstworldproblems that I have and how some people have actual problems and can still be happy and behold the beam at the end of the tunnel	73	0	see the light
0.09325426816940308	0	0	I'm part of the Vast Right Wing Conspiracy, but I'd have voted for Hillary in a heartbeat	I'm part of the Vast Right Wing Conspiracy, but I'd have voted for Hillary in a periodic event	403	0	in a heartbeat
0.8599106073379517	1	1	They do make really high price models from time to time, tho (Porshe carrera GT comes to mind)	They do make really high price models sometimes, tho (Porshe carrera GT comes to mind)	411	0	from time to time
0.14819642901420593	0	0	You assume this option is off the table in real life	You assume this option is off the desk in real life	139	0	off the table
0.9290027618408203	1	1	cool, I'll hit your sub from time to time and try to shoot you some support	cool, I'll hit your sub every once in a while and try to shoot you some support	242	1	from time to time
0.6712719202041626	1	1	"What part are you having difficulty understanding?  Christians received an *explicit* instruction from Peter--to whom had been given "the keys to the kingdom of heaven" and the rabbinical power to "bind and loose"--that they could eat whatever they wanted	"What part are you having difficulty understanding?  Christians received an *explicit* instruction from Peter--to whom had been put in charge and the rabbinical power to "bind and loose"--that they could eat whatever they wanted	387	1	keys to the kingdom
0.2942112684249878	0	0	You can't have it both ways	You can't bear it in both styles	41	0	have it both ways
-0.005273044109344482	0	0	"On the one hand, I feel bad for them, but on the other hand, I can't imagine any science field where you can just casually throw out ""or maybe it's like that because that's how God wants it to be"" and not have negative repercussions"	"On a single leg, I feel bad for them, but on the alternative leg, I can't imagine any science field where you can just casually throw out ""or maybe it's like that because that's how God wants it to be"" and not have negative repercussions"	173	0	on the other hand
0.7221226692199707	1	1	You know I tried to post an article on r/soccer about investing in Man United, which is having an IPO this year (or whatever they call it across the pond)	You know I tried to post an article on r/soccer about investing in Man United, which is having an IPO this year (or whatever they call it in the US)	451	0	across the pond
0.5897153615951538	1	1	And my retired Uncle, not so savvy, would go in with his MBP and digital camera and just spend time with various odds and ends - he had a tremendous amount of praise for it as well	And my retired Uncle, not so savvy, would go in with his MBP and digital camera and just spend time with various stuff - he had a tremendous amount of praise for it as well	148	0	odds and ends
0.9860213994979858	1	1	I know it's not the same scale, but I've definitely heard them trash-talk a movie, then announce it as one of their sponsors in the same breath	I know it's not the same scale, but I've definitely heard them trash-talk a movie, then announce it as one of their sponsors in the same context	107	0	in the same breath
0.938370943069458	1	1	I think a relationship is in the works	I think a relationship is likely	45	0	in the works
0.09248325228691101	0	0	Do you really have nothing better to do than make people who feel like shit feel even shittier? Maybe you should get a life, not troll	Do you really have nothing better to do than make people who feel like shit feel even shittier? Maybe you should get a soul, not troll	239	1	get a life
0.4175567626953125	0	0	I once dreamt that I took a long, satisfying piss, and I didn't even wet the bed IRL	I once dreamt that I took a long, satisfying piss, and I didn't even wet the couch IRL	360	1	wet the bed
0.748961329460144	1	1	Isn't the elephant in the room how the f he's typing without arms?	Isn't the big thing how the f he's typing without arms?	81	0	elephant in the room
0.6796059608459473	1	1	Do I think we should stone all the gays?   Well, it says in the Bible we should do that, and since I can't prove to your satisfaction that Jehovah doesn't exist, I better get with the program!	Do I think we should stone all the gays?   Well, it says in the Bible we should do that, and since I can't prove to your satisfaction that Jehovah doesn't exist, I better be careful!	32	0	get with the program
1.0184139013290405	1	1	You want someone who doesn't change their opinion in the face of new information?	You want someone who doesn't change their opinion when learns new information?	167	0	in the face of
0.30020368099212646	0	0	I've got a grid of RGB LEDs in the works that is 40x24	I've got a grid of RGB LEDs in the building complex that is 40x24	446	0	in the works
-0.02121397852897644	0	0	My friend was dating a guy that was hooking up with chicks all over the place and blatantly	My friend was dating a guy that was hooking up with chicks all over the birthplace and blatantly	72	0	all over the place
1.0565376281738281	1	1	The odds of two people really being on the same page aren't all that great	The odds of two people really having the same opinion isn't all that great	229	1	on the same page
0.5858134031295776	1	1	Something along the lines of "meat is made out of animals	Something similair to "meat is made out of animals	272	1	along the lines
0.5347137451171875	1	0	The world will never break the cycle of famine and tribal war in places like Somalia without breaking the desperate subsistence economy urge to procreate so that at least some kids survive to be future support for their parents and grandparents	The world will never continue famine and tribal war in places like Somalia without breaking the desperate subsistence economy urge to procreate so that at least some kids survive to be future support for their parents and grandparents	234	1	break the cycle
-0.07953757047653198	0	0	now imagine the behind the scenes events that led the SandP to downgrade the US debt	now imagine the behind the area events that led the SandP to downgrade the US debt	1	0	behind the scenes
0.7250487208366394	1	1	It's not always easy making decisions on the fly as a DM but here's what he probably should have done so that it wasn't obvious that he was protecting the dragon	It's not always easy making decisions without preparation as a DM but here's what he probably should have done so that it wasn't obvious that he was protecting the dragon	483	0	on the fly
0.9012466073036194	1	1	Also the gpu in this thing is nothing to write home about	Also the gpu in this thing is nothing to be proud of	337	1	nothing to write home about
0.5985541939735413	1	0	A lot of stuff in midtown used to be meter-free and now they're all over the place	A lot of stuff in midtown used to be meter-free and now they're quite rare	315	1	all over the place
0.7648564577102661	1	1	It would make things more intuitive for people who don't know about sister sizing, but I think it would do much more good to do some sort of information campaign to get the word out and teach people about bra sizing (and maybe find a way to reduce letter-phobia)	It would make things more intuitive for people who don't know about sister sizing, but I think it would do much more good to do some sort of information campaign make it broadly known and teach people about bra sizing (and maybe find a way to reduce letter-phobia)	340	1	get the word out
0.7219059467315674	1	1	In essence, it looks like what you're saying is "don't go against the grain of society, because society doesn't like that", and OP is more like "haters gonna hate, we'll do what we think is right regardless"	In essence, it looks like what you're saying is "don't buck societal norms, because society doesn't like that", and OP is more like "haters gonna hate, we'll do what we think is right regardless"	363	1	go against the grain
0.6308519840240479	1	1	But, like I said, in light of my experiences, for me it would be illogical not to have faith	But, like I said, after my experiences, for me it would be illogical not to have faith	248	1	in light of
0.8452306985855103	1	1	I once caught him rip a vent off of the front counter where our ice machine was housed, that was a pain in the ass to put back on	I once caught him rip a vent off of the front counter where our ice machine was housed, that wasn't easy to fix	206	1	pain in the ass
0.33042722940444946	0	0	Hormones are all over the place after you give birth, and lactation hormones in particular are a libido killer	Hormones are all around the location after you give birth, and lactation hormones in particular are a libido killer	477	0	all over the place
-0.47390955686569214	0	0	I also have rest "generic tags" which could be used to put anything else which does not fit or just create "custom tags" on the fly for whatever workflow you need to work at	I also have rest "generic tags" which could be used to put anything else which does not fit or just create "custom tags" on the spider for whatever worklow you need to work at	394	1	on the fly
0.1427564024925232	0	0	That;s what I was thinking, I mean you wouldn't bother posting the dime a dozen monsters, it's the hot ones that get the attention	That;s what I was thinking, I mean you wouldn't bother posting the dime a boxcars monsters, it's the hot ones that get the attention	151	0	dime a dozen
0.6146424412727356	1	0	Hmm let's see, zero percent of nothin' is, let me do the math here	Hmm let's see, zero percent of nothin' is, let me do applied mathematics here	8	0	do the math
0.2309158444404602	0	0	Did this happen to a friend of yours? A buddy of mine went through sorta the same thing so it hits close to home	Did this happen to a friend of yours? A buddy of mine went through sorta the same thing so it hits close to residence	163	0	close to home
0.7799707055091858	1	1	I'm the sort who likes to imagine both sides of an arms race, so my thinking is that Betazoids would be employed on the sly and passed off as other races (originally Betazoids were portrayed as having black irises but this was done away with in later seasons - consequently they look identical to humans)	I'm the sort who likes to imagine both sides of an arms race, so my thinking is that Betazoids would be employed secretly and passed off as other races (originally Betazoids were portrayed as having black irises but this was done away with in later seasons - consequently they look identical to humans)	354	1	on the sly
0.6082092523574829	1	0	As you can see, looking at the big picture is a large distraction in which helmet-law deniers try and muddy the waters with assumptions, spurious statistical interpretations, irrelevant side issues and unfounded claims	As you can see, looking at the big picture is a large distraction in which helmet-law deniers try to make it quite clear with assumptions, spurious statistical interpretations, irrelevant side issues and unfounded claims	362	1	muddy the waters
0.06437689065933228	0	0	thought you were getting a SV650, why the change of heart?	thought you were getting a SV650, why keep your opinion constant	383	1	change of heart
0.5612147450447083	1	1	I'm the sort who likes to imagine both sides of an arms race, so my thinking is that Betazoids would be employed on the sly and passed off as other races (originally Betazoids were portrayed as having black irises but this was done away with in later seasons - consequently they look identical to humans)	I'm the sort who likes to imagine both sides of an arms race, so my thinking is that Betazoids would be employed sneakily and passed off as other races (originally Betazoids were portrayed as having black irises but this was done away with in later seasons - consequently they look identical to humans)	354	1	on the sly
0.697760820388794	1	1	I've picked up a few words of Greek, Slavonic, and yeah, Japanese over the last couple of years, but my idea of normal is still what strikes me as close to home	I've picked up a few words of Greek, Slavonic, and yeah, Japanese over the last couple of years, but my idea of normal is still what strikes me first-hand	83	0	close to home
0.32901090383529663	0	0	I don't know if it's a "fetish," necessarily, but he's (I'm gonna go out on a limb here and assume it's a "he") very disturbed	I don't know if it's a "fetish," necessarily, but he's (I'm gonna go out on a nail and assume it's a "he") very disturbed	200	1	go out on a limb
0.8782787322998047	1	1	Whatever the encoding or compression, 10Mbps is 10Mbps; you're not going to create information out of thin air further down the line	Whatever the encoding or compression, 10Mbps is 10Mbps; you're not going to create information out of the blue down the line	221	1	out of thin air
1.070430874824524	1	1	"well this is right, what the ""best"" means is defined by the time"	"well this is right, what the ""best"" means is defined before"	7	0	by the time
0.6719548106193542	1	1	"the only way they can ""stimulate"" the economy is by taking it from the taxpayers directly, or going deeper into debt and putting the taxpayers on the hook for that debt"	"the only way they can ""stimulate"" the economy is by taking it from the taxpayers directly, or going deeper into debt and putting the taxpayers charged with that debt"	500	0	on the hook
0.31363898515701294	0	0	Im going to attempt to have a go at doing what I can to it for the next week, its been one of those 'never happy with it, so never finished it' projects	Im going to attempt to give up at doing what I can to it for the next week, its been one of those 'never happy with it, so never finished it' projects	263	1	have a go
-0.16659194231033325	0	0	Though I still like the weed from time to time	Though I still like the weed from case to case	102	0	from time to time
0.7522668838500977	1	1	you get the best of both worlds, alcohol takes the paranoia away for the most part, and weed takes the nausea away if there was any (for me at least)	you get the good mix, alcohol takes the paranoia away for the most part, and weed takes the nausea away if there was any (for me at least)	399	1	best of both worlds
1.0982110500335693	1	1	What you talk about in this post is yet another reason why MRA is politically dead in the water	What you talk about in this post is yet another reason why MRA has no political activity	343	1	dead in the water
0.7037782073020935	1	1	The kind you felt when you had nothing to stress about, not even day to day things like putting food on the table, work and other obligations	The kind you felt when you had nothing to stress about, not even day to day things like providing for yourself, work and other obligations	480	0	put food on the table
0.6330139636993408	1	1	Do people hate Xpander that much?  I got married 10 years ago and am out of touch, sorry	Do people hate Xpander that much?  I got married 10 years ago and don't understand current norms, sorry	258	1	out of touch
0.07366859912872314	0	0	I'm part of the Vast Right Wing Conspiracy, but I'd have voted for Hillary in a heartbeat	I'm part of the Vast Right Wing Conspiracy, but I'd have voted for Hillary in a diastole	403	0	in a heartbeat
0.20892179012298584	0	0	Apart from Better Than Wolves being a rhetorical slap in the face by the creator to Notch's updates, how well does BTW work online? or on older PC's/Laptops that can't run MC with it	Apart from Better Than Wolves being a rhetorical blow in the external body part by the creator to Notch's updates, how well does BTW work online? or on older PC's/Laptops that can't run MC with it	146	0	slap in the face
0.8609791994094849	1	1	You could ruin your RSO financially in the long run	You could ruin your RSO financially in the end	218	1	in the long run
0.13874363899230957	0	0	Don't think Ron Paul wouldn't let these assholes get away with murder just like Romney would	Don't think Ron Paul wouldn't let these assholes go away with assassination just like Romney would	160	0	get away with murder
0.9721945524215698	1	1	The rest of the album is pretty good too, and AmazonMP3 puts it in sale from time to time	The rest of the album is pretty good too, and AmazonMP3 puts it in sale sometimes	23	0	from time to time
1.2655649185180664	1	1	You're going to M from time to time for the amazing health benefits of O	You're going to M occasionally for the amazing health benefits of O	409	0	from time to time
0.6002915501594543	1	1	As for the offense, the preseason is mostly just coaches trying not to tip their hands anyway, so I'm sure most of the plays we ran last night were poorly rehearsed, and will never see the light of day	As for the offense, the preseason is mostly just coaches trying not to tip their hands anyway, so I'm sure most of the plays we ran last night were poorly rehearsed, and will never appear	35	0	see the light of day
0.3958972692489624	0	0	However, if either of these people are the Republican candidate, I will vote for Obama in a heartbeat	However, if either of these people are the Republican candidate, I will vote for Obama in the end	319	1	in a heartbeat
-0.11379754543304443	0	0	What I mean by that is life will throw some terrible shit at you from time to time	What I mean by that is life will throw some terrible shit at you from case to case	464	0	from time to time
-0.07372105121612549	0	0	I'm sick and tired of this meme	I'm sick and hungry of this meme	241	1	sick and tired
-0.1612117886543274	0	0	I've seen her, I get the point! It's almost like they don't have any other siblings	I've seen her, I understand her point! It's almost like they don't have any other siblings	233	1	get the point
0.6672255992889404	1	1	Because I told myself that I need to at least talk about this to someone, and I've told myself that I will try hormones for at least a month, to test the waters	Because I told myself that I need to at least talk about this to someone, and I've told myself that I will try hormones for at least a month, explore the effects	204	1	test the waters
0.7043370008468628	1	1	I don't see why tax payers are now on the hook for $600M due to a decision that we had no control over, after being told by the Liberals they wouldn't be implementing HST prior to the election	I don't see why tax payers are now charged with $600M due to a decision that we had no control over, after being told by the Liberals they wouldn't be implementing HST prior to the election	186	0	on the hook
0.03521093726158142	0	0	The key to it is just finding out a way to reach for the stars and beyond	The key to it is just finding out a way to strive for the celestial body and beyond	49	0	reach for the stars
0.9571421146392822	1	1	Other than that I'm in the clear	Other than that I'm lacking issues	367	1	in the clear
0.637458324432373	1	1	"One day my sister came up to me with a friend of hers, out of the blue, and said ""Hey come to the backyard we wanna show you something"	"One day my sister came up to me with a friend of hers, unexpectedly, and said ""Hey come to the backyard we wanna show you something"	468	0	out of the blue
0.8120176792144775	1	1	You on the other hand do have a pretty skinny figure	You on the contrary do have a pretty skinny figure	405	0	on the other hand
0.1339840590953827	0	0	This is definitely an accurate portrayal of an acidhead behind the wheel	This is definitely an accurate portrayal of an acidhead behind the spin	195	0	behind the wheel
0.4815945625305176	0	1	and before any douchebag comes in with the old tit for tat logical failure, I'm well aware how fucked my country is right now	and before any douchebag comes in with the old eye for eye logical failure, I'm well aware how fucked my country is right now	131	0	tit for tat
0.5849173665046692	1	1	That meant more debt, but if done right, it would also create jobs and investment that were desperately needed in the face of the catastrophe that had just happened	That meant more debt, but if done right, it would also create jobs and investment that were desperately needed at risk of the catastrophe that had just happened	36	0	in the face of
-0.08240139484405518	0	0	It's the same story it's always been, if the artists/label/management stand a chance of losing money, they think it's best to remove any possibility of that happening	It's the same story it's always been, if the artists/label/management stand up to lose money, they think it's best to remove any possibility of that happening	372	1	stand a chance
0.33212172985076904	0	0	TotalBiscuit talked about this a couple days ago, how Riot's constant need to release new champions is not sustainable in the long run	TotalBiscuit talked about this a couple days ago, how Riot's constant need to release new champions is not sustainable in the lengthy marathon	421	0	in the long run
-0.12162339687347412	0	0	Just feeding you some food for thought	Just feeding you some substance for content	6	0	food for thought
0.9370909929275513	1	1	Either way I'm not interested enough in the band to care that much so we're on the same page :)	Either way I'm not interested enough in the band to care that much so we're in agreement :)	406	0	on the same page
0.7930546998977661	1	1	I once dreamt that I took a long, satisfying piss, and I didn't even wet the bed IRL	I once dreamt that I took a long, satisfying piss, and I didn't even pee in my bed IRL	360	1	wet the bed
0.9043078422546387	1	1	Either way I'm not interested enough in the band to care that much so we're on the same page :)	Either way I'm not interested enough in the band to care that much so we're of one mind :)	406	0	on the same page
0.07173603773117065	0	0	With bells and whistles like a full gaming mouse and keyboard + a great sound system, that still wouldn't take us over $1100	With church bell and boat whistle like a full gaming mouse and keyboard + a great sound system, that still wouldn't take us over $1100	168	0	bells and whistles
0.8919162154197693	1	1	I find it hilarious how you people are watching your country get run into the ground	I find it hilarious how you people are watching your country get worse and worse	368	1	run into the ground
0.32472237944602966	0	0	"It's harder to keep track of what's going on in the code when there are lots of `echo ""&lt;tag&gt;"";` lines littered all over the place"	"It's harder to keep track of what's going on in the code when there are lots of `echo ""&lt;tag&gt;"";` lines littered all over the location"	50	0	all over the place
-0.05457353591918945	0	0	Art is an expression that, at the best of times, evokes emotion	Art is an expression that, at the most of periods, evokes emotion	100	0	at the best of times
-0.23746579885482788	0	0	If a company believes in the power of word of mouth, this is free PR	If a company believes in the power of anagram of mouth, this is free PR	157	0	word of mouth
