classifier_prob	classifier_judgement	true_label	sentence_1	sentence_2	Index	Flag	Idiom
0.4711419939994812	0	0	"There's a plaque in a bar I used to go to that says something along the lines of ""On August 18, 1998, bartender John Jones pulled a royal flush of PBR caps from five consecutive bottles"	"There's a plaque in a bar I used to go to that says something along the shapes of ""On August 18, 1998, bartender John Jones pulled a royal flush of PBR caps from five consecutive bottles"	472	0	along the lines
0.3630402684211731	0	0	The only thing is I work full time (and then some) and I'm quite long out of school, so now I come to evaluate it, having an afternoon session that is a more in-depth version (more or less) of the morning one will really streamline the studying	The only thing is I work full time (and that's it) and I'm quite long out of school, so now I come to evaluate it, having an afternoon session that is a more in-depth version (more or less) of the morning one will really streamline the studying	257	1	and then some
0.5070916414260864	1	1	Essentially, the non-monogomous relationships are happening whether they are admitted to or not, it's then swept under the rug by the offending party being dishonest with their SO until found out, and then both parties often remaining dishonest with the world to avoid scandal while trying to figure out how to reconfigure their relationship	Essentially, the non-monogomous relationships are happening whether they are admitted to or not, it's then ducked out by the offending party being dishonest with their SO until found out, and then both parties often remaining dishonest with the world to avoid scandal while trying to figure out how to reconfigure their relationship	192	0	under the rug
0.4742206037044525	0	0	These are generally the most productive immigrants in Canada, however the immigration system as a whole is a net benefit to Canada and one shouldn't jump to conclusions about any of the categories	These are generally the most productive immigrants in Canada, however the immigration system as a whole is a net benefit to Canada and one shouldn't build an opinion supported by fact about any of the categories	237	1	jump to conclusions
0.5236867666244507	1	1	You should definitely check out the rest of this CD, it's all over the place in terms of style and influence, so this one song is not indicative of the rest of it	You should definitely check out the rest of this CD, it's a broad mix in terms of style and influence, so this one song is not indicative of the rest of it	222	1	all over the place
0.21413232386112213	0	0	The odds of two people really being on the same page aren't all that great	The odds of two people really being on the same block isn't all that great	229	1	on the same page
-0.45724764466285706	0	0	I'd say you hit the nail on the head	I'd say you propel the screw on the body part	400	0	hit the nail on the head
0.6741937398910522	1	1	Confrontation might actually make matters worse	Confrontation might actually not make anything better	381	1	make matters worse
0.49486851692199707	0	1	"Maybe you don't call a spade a spade to their face, but if someone is pulling ""I'm going to kill you"", you know, I think I *might* resort to calling her a slut"	"Maybe you don't say it directly to their face, but if someone is pulling ""I'm going to kill you"", you know, I think I *might* resort to calling her a slut"	155	0	call a spade a spade
0.6064978241920471	1	1	Holy shit I'm in the same boat as you	Holy shit I'm as pressed as you	162	0	in the same boat
0.5677172541618347	1	1	I live on Leni, this is getting a little too close to home :)	I live on Leni, this is getting a little too related to my situation :)	351	1	close to home
0.3991090953350067	0	1	Thats when I wake up in a jolt with my heart rate through the roof hoping I'm actually awake, not dreaming I'm awake	Thats when I wake up in a jolt with my heart rate out of norm hoping I'm actually awake, not dreaming I'm awake	261	1	through the roof
0.6953557729721069	1	1	This is an episode of six feet under	This is an episode of death	16	0	six feet under
0.43963250517845154	0	0	It will probably make America’s long-run deficit problem worse, not better; and most important, by demonstrating that raw extortion works and carries no political cost, it will take America a long way down the road to banana-republic status	It will probably make America’s long-run deficit problem worse, not better; and most important, by demonstrating that raw extortion works and carries no political cost, it will take America a long way down the way to banana-republic status	470	0	down the road
0.4825356900691986	0	1	Since this is the case I suppose we can agree to disagree	Since this is the case I suppose we can have different opinions	232	1	agree to disagree
0.44693630933761597	0	1	If this girl keep showing up all over the place I'm doing to hit someone	If this girl keep showing up wherever I go I'm doing to hit someone	443	0	all over the place
0.4725823998451233	0	1	I wish you and your daughter the very best, and I know that America is frustrating at times, but success is the best revenge in the face of adversity! Just start off with goals and go from there	I wish you and your daughter the very best, and I know that America is frustrating at times, but success is the best revenge against the pressing adversity! Just start off with goals and go from there	63	0	in the face of
0.21369022130966187	0	0	Seems like a good deal	Seems like a good transaction	27	0	a good deal
0.4286821782588959	0	0	You should definitely check out the rest of this CD, it's all over the place in terms of style and influence, so this one song is not indicative of the rest of it	You should definitely check out the rest of this CD, it's homogenous in terms of style and influence, so this one song is not indicative of the rest of it	222	1	all over the place
0.8357295989990234	1	1	I don't know if it's a "fetish," necessarily, but he's (I'm gonna go out on a limb here and assume it's a "he") very disturbed	I don't know if it's a "fetish," necessarily, but he's (I'm gonna make an assumptions it's a "he") very disturbed	200	1	go out on a limb
0.2677980661392212	0	0	Yes, yes, we all knew rich people can afford more drugs already, no need to rub it in	Yes, yes, we all knew rich people can afford more drugs already, no need to touch it in.	277	1	rub it in
0.6663305163383484	1	1	The rule of thumb is that if there are 3x the number of players remaining than the number of players who get paid, you ignore the bubble	The method is that if there are 3x the number of players remaining than the number of players who get paid, you ignore the bubble	26	0	rule of thumb
0.8480406999588013	1	1	My friend was dating a guy that was hooking up with chicks all over the place and blatantly	My friend was dating a guy that was hooking up with chicks here and there and blatantly	72	0	all over the place
0.7523301243782043	1	1	Hey! I'd love some more info on this, and the company, if you get the time! Thanks!	Hey! I'd love some more info on this, and the company, if you have the opportunity! Thanks!	344	1	get the time
0.4405268430709839	0	0	Once you get them IDed it's just a matter of finding them, you'll know when on the clock already	Once you get them IDed it's just a matter of finding them, you'll know when on the alarm clock already	404	0	on the clock
0.6362257599830627	1	1	This is me to a T, except I quit giving a shit about the shit I was good at in college as I learned in many ways High School never ends!	This is me titally, except I quit giving a shit about the shit I was good at in college as I learned in many ways High School never ends!	132	0	to a T
-0.1479199230670929	0	0	And this can cut both ways	And this can separate both options	44	0	cut both ways
0.6396201848983765	1	1	I had to go to extra tutoring which cost an arm and a leg	I had to go to extra tutoring which cost a lot	322	1	arm and a leg
0.59940105676651	1	1	I think you're on the right track for first version antennas	I think you're working process is correct for first version antennas	236	1	on the right track
0.9655593633651733	1	1	I see fat Brits all over the place	I see fat Brits widespread	431	0	all over the place
0.24311384558677673	0	1	You assume this option is off the table in real life	You assume this option is off reach in real life	139	0	off the table
0.47296860814094543	0	1	They work in a pinch, but if you are going to bother running cable you may as well do it right	They work if you are constrained, but if you are going to bother running cable you may as well do it right	324	1	in a pinch
0.34752196073532104	0	0	"the only way they can ""stimulate"" the economy is by taking it from the taxpayers directly, or going deeper into debt and putting the taxpayers on the hook for that debt"	"the only way they can ""stimulate"" the economy is by taking it from the taxpayers directly, or going deeper into debt and putting the taxpayers on the peg for that debt"	500	0	on the hook
0.2346275895833969	0	0	Whatever the encoding or compression, 10Mbps is 10Mbps; you're not going to create information out of thin air further down the line	Whatever the encoding or compression, 10Mbps is 10Mbps; you're not going to create information using the air down the line	221	1	out of thin air
0.5963011980056763	1	0	I once caught him rip a vent off of the front counter where our ice machine was housed, that was a pain in the ass to put back on	I once caught him rip a vent off of the front counter where our ice machine was housed, that was painless to put back on	206	1	pain in the ass
0.9064202308654785	1	0	&gt; Considering how poorly Israel did against Hezbollah in Lebanon, I doubt fighting Iran would be a walk in the park	&gt; Considering how poorly Israel did against Hezbollah in Lebanon, I doubt fighting Iran would be difficult	228	1	walk in the park
0.32664954662323	0	0	They had somewhat steep requirements for being hired on as a regular so they simply paid the majority of people there six dollars less and made them jump through hoops for the special prize	They had somewhat steep requirements for being hired on as a regular so they simply paid the majority of people there six dollars less and made them jump on the phone for the special prize	300	1	jump through hoops
0.485405296087265	0	1	Her total cost out of pocket?  Roughly $240 - one of her anti-rejection medications isn't covered (an antibiotic), and it costs us about $10 a month	The total amount she had to pay? Roughly $240 - one of her anti-rejection medications isn't covered (an antibiotic), and it costs us about $10 a month	246	1	out of pocket
0.971772313117981	1	1	I find that generally people that have  tendency for being haters usually have a deep self hatred they can't come to grips with	I find that generally people that have  tendency for being haters usually have a deep self hatred they can't come to an understanding	349	1	come to grips with
0.6355072855949402	1	1	I find that developing your "working memory" will help, although I haven't done anything along these lines yet so I'll get back at you with results when I do	I find that developing your "working memory" will help, although I haven't done anything along these lines yet so I'll reply when I do	215	1	back at you
-0.24755719304084778	0	0	They mostly just go with the flow	They mostly just move with the airflow	169	0	go with the flow
0.9743862152099609	1	1	I have found through my personal experience that I should take everything that science tells us about metabolism etc with a grain of salt	I have found through my personal experience that I should take everything that science tells us about metabolism etc doubtfully	471	0	with a grain of salt
0.6294950246810913	1	1	wait, on second thought this might force him to rely on his striking more	wait, alternatively this might force him to rely on his striking more	123	0	on second thought
0.4531093239784241	0	0	"The Japanese Gardens tend to have ""free"" days from time to time"	"The Japanese Gardens tend to have ""free"" days from case to case"	18	0	from time to time
0.2838512063026428	0	0	"I agree that mentioning Amy Winehouse in the same breath as the ""27 Death Club,"" or whatever people call it, is premature"	"I agree that mentioning Amy Winehouse in the same inhale as the ""27 Death Club,"" or whatever people call it, is premature"	74	0	in the same breath
0.9059618711471558	1	1	Everything has been smoke and mirrors	Everything has been altered reality	359	1	smoke and mirrors
0.723969578742981	1	0	As a former bicycle messenger in San Francisco, I was *paid* to break every traffic law in the books	As a former bicycle messenger in San Francisco, I was *paid* to break every traffic law I came up with	332	1	in the books
0.6515284776687622	1	1	If you are happy with Gentoo, by all means, use Gentoo, but I'll stick to Arch	If you are happy with Gentoo, use Gentoo, but I'll stick to Arch	280	1	by all means
0.4975084066390991	0	1	I was there in 2002 so maybe my memory is skewed, but biking past them I can definitely say they reminded me of that rock in australia just sticking up out of nowhere	I was there in 2002 so maybe my memory is skewed, but biking past them I can definitely say they reminded me of that rock in australia just sticking without any obvious reason	203	1	out of nowhere
0.23475652933120728	0	0	No drugstore products come to mind other than Max Factor, but I'm not sure how that one is	No drugstore products are forgotten other than Max Factor, but I'm not sure how that one is	225	1	come to mind
0.7219887971878052	1	0	They don't want to deal with primadonnas who will be a pain in the ass about their "baby	They don't want to deal with primadonnas who will be easy to work with on their "baby	397	1	pain in the ass
0.5704754590988159	1	1	They have some specialty skills that they bring to the table, but from my experience they have this mindset that they are better than everyone else and they can just do whatever they want	They have some specialty skills that they put forward, but from my experience they have this mindset that they are better than everyone else and they can just do whatever they want	53	0	bring to the table
0.8832293748855591	1	1	&gt; Considering how poorly Israel did against Hezbollah in Lebanon, I doubt fighting Iran would be a walk in the park	&gt; Considering how poorly Israel did against Hezbollah in Lebanon, I doubt fighting Iran would be easy	228	1	walk in the park
0.688242495059967	1	1	Karma on the other hand was created to be a balance between offense and defense	Karma unlike the prior was created to be a balance between offense and defense	304	1	on the other hand
0.34239673614501953	0	0	Leave it to the baby boomers to take a world where one could pay for college by working a part time summer job, and turn it into a world where two parents with full time jobs can't make ends meet	Leave it to the baby boomers to take a world where one could pay for college by working a part time summer job, and turn it into a world where two parents with full time jobs can't make extremities connect	416	0	make ends meet
0.43461769819259644	0	0	There is really really big money in cancer care and the attendant medications used, clinics all over the place, and if there was a great cure rate, lets face it, lots of the businesses would be forced to cut back or shut down	There is really really big money in cancer care and the attendant medications used, clinics all over the point, and if there was a great cure rate, lets face it, lots of the businesses would be forced to cut back or shut down	15	0	all over the place
0.8098523020744324	1	1	I've thought of you from time to time since your last AMA and the other thread you posted about your friend	I've thought of you occasionally since your last AMA and the other thread you posted about your friend	295	1	from time to time
0.9183807969093323	1	1	Annnnd there's the elephant in the room, which is super capital logoff timers	Annnnd there's the an important item people won't talk about, which is super capital logoff timers	395	1	elephant in the room
0.37060976028442383	0	0	DX 2 is just a fun little project, and DX3, well there's already a ton of LP's out there, and I can't compete with their speed or fame, I mean Yoggscast and other stuff are already up and running, and I saw someone up to part 34 on day one	DX 2 is just a fun little project, and DX3, well there's already a ton of LP's out there, and I can't compete with their speed or fame, I mean Yoggscast and other stuff are already up and jogging, and I saw someone up to part 34 on day one	461	0	up and running
0.2796097993850708	0	0	I've picked up a few words of Greek, Slavonic, and yeah, Japanese over the last couple of years, but my idea of normal is still what strikes me as close to home	I've picked up a few words of Greek, Slavonic, and yeah, Japanese over the last couple of years, but my idea of normal is still what strikes me as proximal to residence	83	0	close to home
0.5434181094169617	1	0	I was there in 2002 so maybe my memory is skewed, but biking past them I can definitely say they reminded me of that rock in australia just sticking up out of nowhere	I was there in 2002 so maybe my memory is skewed, but biking past them I can definitely say they reminded me of that rock in australia just sticking surrounded by other rocks ranges	203	1	out of nowhere
0.5086673498153687	1	1	Sorry to barge in the conversation, and I'm not trying to steal jobs from ohhaither, by all means go with him/her first if he's the man/woman, but I'm a freelance web developer that also started not too long ago and since I've been doing mainly WordPress development	Sorry to barge in the conversation, and I'm not trying to steal jobs from ohhaither, definitely go with him/her first if he's the man/woman, but I'm a freelance web developer that also started not too long ago and since I've been doing mainly WordPress development	492	0	by all means
0.5761615633964539	1	1	I dated an incredibly loopy Christian girl in college and was engaged to her before she broke up with me out of the blue (she thought I was cheating on her with multiple women because apparently I am insatiable)	I dated an incredibly loopy Christian girl in college and was engaged to her before she broke up with me unexpectedly (she thought I was cheating on her with multiple women because apparently I am insatiable)	95	0	out of the blue
0.7708320617675781	1	1	Generally speaking, my (new) rule of thumb is to look at their security status	Generally speaking, my (new) method is to look at their security status	476	0	rule of thumb
0.06809014081954956	0	0	You're suggesting a live and let live attitude	You're suggesting an exist and induce live attitude	94	0	live and let live
0.3516156077384949	0	0	My argument is more than a little extremist, especially in this day and age, but I do think there's a lot of legitimacy to this approach	My argument is more than a little extremist, especially in this weekday, but I do think there's a lot of legitimacy to this approach	330	1	in this day and age
0.7031316161155701	1	1	I've got a grid of RGB LEDs in the works that is 40x24	I've got a grid of RGB LEDs in progress that is 40x24	446	0	in the works
0.5705057978630066	1	1	The rest of the album is pretty good too, and AmazonMP3 puts it in sale from time to time	The rest of the album is pretty good too, and AmazonMP3 puts it in sale occasionally	23	0	from time to time
0.5712542533874512	1	0	You should swap out those bars too! That design is used on a number of honda cruisers of the era and I find them to be at the very least a pain in the ass to use	You should swap out those bars too! That design is used on a number of honda cruisers of the era and I find them to be at the very least easy to use	327	1	pain in the ass
0.9917430877685547	1	1	Keeping the money close to home is one of the big ones	Keeping money that is easy to access is one of the big ones	216	1	close to home
0.9390796422958374	1	1	Some days I just have it, and other days I can barely run a mile	Some days I just have it, and other days I can barely do something	159	0	run a mile
0.8912736177444458	1	1	We love our surname and it suits us to a T	We love our surname and it suits us perfectly	388	1	to a T
0.7027322053909302	1	0	"I think he has bigger fish to fry"The drug war is the elephant fish in the room IMO	"I think he has smaller problems to address"The drug war is the elephant fish in the room IMO	389	1	bigger fish to fry
0.40470361709594727	0	1	I was really expecting an international incident uncovering high ranking officials after the ICE agents were killed in Mexico with US smuggled machine guns but that shit got sweeped under the rug	I was really expecting an international incident uncovering high ranking officials after the ICE agents were killed in Mexico with US smuggled machine guns but that shit was covered up	253	1	under the rug
0.13782373070716858	0	0	But I would *not* bet the farm on such an uncertain play	But I would *not* predict the plantation on such an uncertain play	122	0	bet the farm
0.3628591299057007	0	1	I am very interested in discussing these ideas because, to be perfectly honest with you, I think a good deal of them make a lot of sense	I am very interested in discussing these ideas because, to be perfectly honest with you, I think a large number of them make a lot of sense	97	0	a good deal
0.31892868876457214	0	0	Is your devotion to your team *that* stringent that you're willing to stick by it even in the face of serious injury to another player?	Is your devotion to your team *that* stringent that you're willing to stick by it even in the outlook of serious injury to another player?	414	0	in the face of
0.46885937452316284	0	0	Changing boxers three times a day? That's a bit much	Changing boxers three times a day? That's curious	308	1	a bit much
0.22223055362701416	0	0	And it's only a matter of time before someone realizes if they start a private bus company, or a private park, etc	And it's only a least of day before someone realizes if they start a private bus company, or a private park, etc	161	0	matter of time
0.7903883457183838	1	0	They own the paper, but they don't give a shit what goes into it as long as it's in the black and doesn't get them sued	They own the paper, but they don't give a shit what goes into it as long as it's losing money and doesn't get them sued	224	1	in the black
0.6172686815261841	1	0	I find that developing your "working memory" will help, although I haven't done anything along these lines yet so I'll get back at you with results when I do	I find that developing your "working memory" will help, although I haven't done anything along these lines yet so I'll send results now	215	1	back at you
0.3092306852340698	0	0	Seems like only a matter of time to me	Seems like only a matter of luck to me	391	1	matter of time
0.9246001243591309	1	1	Way to set the bar on this one	Way to provide a benchmark on this one	346	1	set the bar
0.7850390672683716	1	1	Mostly words fall on deaf ears	Mostly words are ignored	4	0	fall on deaf ears
0.4750128388404846	0	1	"Mourinho trying to wish good luck to Pepe before the match: ""Go Pepe! break a leg!""Pepe: ""I will""Mourinho: ""ok"	"Mourinho trying to wish good luck to Pepe before the match: ""Go Pepe! best of luck!""Pepe: ""I will""Mourinho: ""ok"	21	0	break a leg
1.1932724714279175	1	1	This could be a blessing in disguise, friend	This could be an inspiration, friend	69	0	blessing in disguise
0.6511359810829163	1	0	I imagine it's somewhat similar to people in combat who stand next to a bomb that goes off and they somehow walk away unscathed, against all odds	I imagine it's somewhat similar to people in combat who stand next to a bomb that goes off and they somehow walk away unscathed, as expected	214	1	against all odds
0.4734366238117218	0	1	"It's harder to keep track of what's going on in the code when there are lots of `echo ""&lt;tag&gt;"";` lines littered all over the place"	"It's harder to keep track of what's going on in the code when there are lots of `echo ""&lt;tag&gt;"";` lines littered scattered"	50	0	all over the place
0.6005839109420776	1	1	com on a whim and it came with crappy DJ software that I tried out	com without prior planning and it came with crappy DJ software that I tried out	336	1	on a whim
0.3334904611110687	0	0	You know I tried to post an article on r/soccer about investing in Man United, which is having an IPO this year (or whatever they call it across the pond)	You know I tried to post an article on r/soccer about investing in Man United, which is having an IPO this year (or whatever they call it across the fishpond)	451	0	across the pond
0.44841358065605164	0	1	As a teenager, I started reading Dawkins books on evolution and Carl Sagan's work, and that's when it all clicked: the universe is wondrous and infinitely complex, and the very fact that any of us are here is an amazing thing - with the multitudes of factors that have to fall into place over billions of years, and how tiny and insignificant we are in the scheme of things, it just seems	As a teenager, I started reading Dawkins books on evolution and Carl Sagan's work, and that's when it all clicked: the universe is wondrous and infinitely complex, and the very fact that any of us are here is an amazing thing - with the multitudes of factors that have to play out over billions of years, and how tiny and insignificant we are in the scheme of things, it just seems	25	0	fall into place
