classifier_prob	classifier_judgement	true_label	sentence_1	sentence_2	Index	Flag	Idiom
0.4077204763889313	0	0	The standard response was somewhere along the lines of 'Stalin did some evil things, but overall he made the USSR strong and we wouldn't have defeated Fascism without him' combined with '____ is just American Capitalist lies and propaganda' etc	The standard response was somewhere along the shapes of 'Stalin did some evil things, but overall he made the USSR strong and we wouldn't have defeated Fascism without him' combined with '____ is just American Capitalist lies and propaganda' etc	181	0	along the lines
0.4572015404701233	0	0	This sort of stuff doesn't pass down generations by word of mouth well, the intensity of the emotional reaction is lost when it isn't actually experienced	This sort of stuff doesn't pass down generations by anagram of mouth well, the intensity of the emotional reaction is lost when it isn't actually experienced	142	0	word of mouth
0.28622978925704956	0	0	I feel like we're on the same page; tho you're much further along in badass status	I feel like we're on the same chapter; tho you're much further along in badass status	498	0	on the same page
-0.06256943941116333	0	0	Only a matter of time before the americans step up to the plate	Only a concern of case before the americans step up to the plate	31	0	matter of time
0.45042359828948975	0	1	I ask for relatively little from my parents because I know they struggle to make ends meet	I ask for relatively little from my parents because I know they struggle to earn enough	194	0	make ends meet
0.32128655910491943	0	0	I think you hit the nail on the head	I think you hit the screw on the head	262	1	hit the nail on the head
0.43469688296318054	0	1	"Sometimes it's obvious, but other times it might seem like you should run, but then the tank ""initiates"" and if everyone had been paying attention you can turn the tide"	"Sometimes it's obvious, but other times it might seem like you should run, but then the tank ""initiates"" and if everyone had been paying attention you can redress the balance"	65	0	turn the tide
0.6478897333145142	1	1	That if you do when to how you can go to do accidentally all over the place	That if you do when to how you can go to do accidentally everywhere	33	0	all over the place
0.6546096205711365	1	1	This is me to a T, except I quit giving a shit about the shit I was good at in college as I learned in many ways High School never ends!	This is me exactly, except I quit giving a shit about the shit I was good at in college as I learned in many ways High School never ends!	132	0	to a T
0.3331553339958191	0	0	Art is an expression that, at the best of times, evokes emotion	Art is an expression that, at the best of moments, evokes emotion	100	0	at the best of times
0.2755911648273468	0	0	Aim and JG mostly, a couple odds and ends from ammo to go	Aim and JG mostly, a couple gambling odds from ammo to go	355	1	odds and ends
0.5321954488754272	1	1	"Maybe you don't call a spade a spade to their face, but if someone is pulling ""I'm going to kill you"", you know, I think I *might* resort to calling her a slut"	"Maybe you don't point it to their face, but if someone is pulling ""I'm going to kill you"", you know, I think I *might* resort to calling her a slut"	155	0	call a spade a spade
0.07957056164741516	0	0	*Puts on sunglasses*luck of the draw	*Puts on sunglasses*luck of the irish	380	1	luck of the draw
0.6204164028167725	1	1	"Take everything you read on ""seddit"" with a grain of salt"	"Take everything you read on ""seddit"" with a doubt"	489	0	with a grain of salt
0.6154900789260864	1	1	For a salesman, you seem to be at a loss for words	For a salesman, you seem to be shocked	58	0	at a loss for words
0.6453337669372559	1	1	Thanks yeah, it was pretty spur of the moment so a bit rough around the edges	Thanks yeah, it was pretty sudden so a bit rough around the edges	193	0	spur of the moment
0.4926658868789673	0	0	Brilliant, the music fit it to a T, that and the troll face painting, had me spit my food on the screen from laughing	Brilliant, the music fit it to a Tea, that and the troll face painting, had me spit my food on the screen from laughing	386	1	to a T
0.43294718861579895	0	1	that being said if you get some for free and wouldn't mind throwing them out and replacing them after a few months of use, or if you wouldn't mind hanging out in a hospital because your gear failed when you needed it not to; then by all means indulge the alternatives	that being said if you get some for free and wouldn't mind throwing them out and replacing them after a few months of use, or if you wouldn't mind hanging out in a hospital because your gear failed when you needed it not to; then surely indulge the alternatives	20	0	by all means
0.22590044140815735	0	0	You're going to M from time to time for the amazing health benefits of O	You're going to M from case to case for the amazing health benefits of O	409	0	from time to time
0.19085127115249634	0	0	Only a matter of time before the americans step up to the plate	Only a least of day before the americans step up to the plate	31	0	matter of time
0.6047857403755188	1	1	"MY teacher apologized as well, but also added a little moral lesson along the lines of ""sometimes life isn't fair, but you should do your best to get through it without complaining"	"MY teacher apologized as well, but also added a little moral lesson like ""sometimes life isn't fair, but you should do your best to get through it without complaining"	447	0	along the lines
0.4064372181892395	0	1	it was after lunch break too so no quick trip to the gas station for me! i sat at my desk for the next 4 hours staring at my screen, i got absolutely no work done and was in so much pain that by the time i got to my car at the end of the day i was a sobbing, blubbering mess	it was after lunch break too so no quick trip to the gas station for me! i sat at my desk for the next 4 hours staring at my screen, i got absolutely no work done and was in so much pain that before i got to my car at the end of the day i was a sobbing, blubbering mess	70	0	by the time
0.3386334776878357	0	0	"There's a plaque in a bar I used to go to that says something along the lines of ""On August 18, 1998, bartender John Jones pulled a royal flush of PBR caps from five consecutive bottles"	"There's a plaque in a bar I used to go to that says something aligned with strings of ""On August 18, 1998, bartender John Jones pulled a royal flush of PBR caps from five consecutive bottles"	472	0	along the lines
0.44573086500167847	0	0	com on a whim and it came with crappy DJ software that I tried out	com from a whim and it came with crappy DJ software that I tried out	336	1	on a whim
0.5647849440574646	1	0	It would probably be all high and mighty about being so much smarter than me	It would probably be all humble about being so much smarter than me	238	1	high and mighty
0.3427460193634033	0	0	I moved halfway through elementary school and years later down the road I was at Yankee game and a kid that was in my 2nd grade class was sitting right behind me	I moved halfway through elementary school and years later down the highway I was at Yankee game and a kid that was in my 2nd grade class was sitting right behind me	491	0	down the road
0.5445476174354553	1	1	Yes, here i am! Surprised this announcement made it here, really happy to see more redditors joining Minus! We've come a long way!!	Yes, here i am! Surprised this announcement made it here, really happy to see more redditors joining Minus! We've progressed!!	147	0	come a long way
0.4017541706562042	0	1	The only thing is I work full time (and then some) and I'm quite long out of school, so now I come to evaluate it, having an afternoon session that is a more in-depth version (more or less) of the morning one will really streamline the studying	The only thing is I work full time (and a while more) and I'm quite long out of school, so now I come to evaluate it, having an afternoon session that is a more in-depth version (more or less) of the morning one will really streamline the studying	257	1	and then some
0.3592701852321625	0	0	I don't see why tax payers are now on the hook for $600M due to a decision that we had no control over, after being told by the Liberals they wouldn't be implementing HST prior to the election	I don't see why tax payers are now on the catch for $600M due to a decision that we had no control over, after being told by the Liberals they wouldn't be implementing HST prior to the election	186	0	on the hook
0.6676466464996338	1	0	He expects more behind the scenes coverage than current terrestial TV	He expects more public coverage than current terrestial TV	353	1	behind the scenes
0.6962294578552246	1	1	"I just googled ""box of cables"" or something like that to get the picture"	"I just googled ""box of cables"" or something like that to know"	128	0	get the picture
1.0064913034439087	1	1	I am going to take a shot in the dark	I am going to make an informed guess	357	1	shot in the dark
0.5404878258705139	1	0	His job was a Room Attendant or "maid" at a hotel in a major American National Park--the lowest on the totem pole for jobs in that neck of the woods	His job was a Room Attendant or "maid" at a hotel in a major American National Park--the lowest on the totem pole for jobs in that head of the forest	356	1	neck of the woods
0.5373912453651428	1	0	Just take everything you read with a grain of salt - if ur convinced I'm just spamming the program there's nothing I can do to make you think otherwise	Just take everything you read  as the truth  - if ur convinced I'm just spamming the program there's nothing I can do to make you think otherwise	260	1	with a grain of salt
0.6710290312767029	1	1	Maybe Mellow Indie if you really had to go above and beyond	Maybe Mellow Indie if you really had to do better	458	0	above and beyond
0.577732503414154	1	0	You should definitely check out the rest of this CD, it's all over the place in terms of style and influence, so this one song is not indicative of the rest of it	You should definitely check out the rest of this CD, it's consistent in terms of style and influence, so this one song is not indicative of the rest of it	222	1	all over the place
0.9446959495544434	1	1	So, in comparison to the cream of the crop, you're a might bit off, but don't worry	So, in comparison to the perfect ones, you're a might bit off, but don't worry	150	0	cream of the crop
0.49714910984039307	0	1	Leave it to the baby boomers to take a world where one could pay for college by working a part time summer job, and turn it into a world where two parents with full time jobs can't make ends meet	Leave it to the baby boomers to take a world where one could pay for college by working a part time summer job, and turn it into a world where two parents with full time jobs can't get along	416	0	make ends meet
0.40765249729156494	0	0	If they ever sell this in the US, I'll buy one one in a heartbeat	If they ever sell this in the US, I'll buy one one in a diastole	432	0	in a heartbeat
0.3446437120437622	0	0	As you can see, looking at the big picture is a large distraction in which helmet-law deniers try and muddy the waters with assumptions, spurious statistical interpretations, irrelevant side issues and unfounded claims	As you can see, looking at the big picture is a large distraction in which helmet-law deniers try and muddy their buddy with assumptions, spurious statistical interpretations, irrelevant side issues and unfounded claims	362	1	muddy the waters
0.7754940986633301	1	1	I think I'm going to hold on to it and maybe I'll find something to do with it later down the road	I think I'm going to hold on to it and maybe I'll find something to do with it later when the time comes	486	0	down the road
0.4093332588672638	0	0	The only pain in the butt was the steroid treatment that they put me on for months after leaving the hospital	The only pain in the leg was the steroid treatment that they put me on for months after leaving the hospital	255	1	pain in the butt
0.5128707885742188	1	1	I'm also hard of hearing and have to read lips occasionally to understand what I'm hearing	I also cant hear well and have to read lips occasionally to understand what I'm hearing	254	1	hard of hearing
0.7990599870681763	1	1	Must be a slap in the face to those who complain about suggestions xD	Must be quite insulting to those who complain about suggestions xD	276	1	slap in the face
0.5776816606521606	1	1	You should swap out those bars too! That design is used on a number of honda cruisers of the era and I find them to be at the very least a pain in the ass to use	You should swap out those bars too! That design is used on a number of honda cruisers of the era and I find them to be at the very least hard to use	327	1	pain in the ass
0.6315054893493652	1	1	Thanks for all of the advice! There's so much to get to grips with	Thanks for all of the advice! There's so much to get a grasp of	174	0	get to grips with
0.7092088460922241	1	1	Microsoft on the other hand present a simple system which can be customised	Microsoft alternatively present a simple system which can be customised	437	0	on the other hand
0.23629441857337952	0	1	Because, he thinks (and I fully agree) that Google's impact on our day-to-day life is far greater and more important in the long run	Because, he thinks (and I fully agree) that Google's impact on our day-to-day life is far greater and more important at a large timescale	298	1	in the long run
1.0459898710250854	1	1	Just food for thought	Just information	121	0	food for thought
0.46332257986068726	0	0	&gt; There isn’t a team out there who doesn’t put some effort into making sure they’ve got players who are easy on the eyes	&gt; There isn’t a team out there who doesn’t put some effort into making sure they’ve got players who are ugly	314	1	easy on the eyes
0.42435476183891296	0	0	I think most of the 5xxx series and the top of the line 6xxx series card is still double bit precision	I think most of the 5xxx series and the top of the class 6xxx series card is still double bit precision	316	1	top of the line
0.4318768084049225	0	1	When the iPad came out, I recall a lot of comments along the lines of "That looks just like a big iPhone	When the iPad came out, I recall a lot of comments in the vein of "That looks just like a big iPhone	303	1	along the lines
1.065756916999817	1	1	You can't have it both ways	You can't have it all	41	0	have it both ways
0.44076043367385864	0	1	A two-back offense is just not in the cards, unless you count Vick as a back alongside McCoy	A two-back offense is just not certain, unless you count Vick as a back alongside McCoy	59	0	in the cards
0.4478755593299866	0	1	I imagine it's somewhat similar to people in combat who stand next to a bomb that goes off and they somehow walk away unscathed, against all odds	I imagine it's somewhat similar to people in combat who stand next to a bomb that goes off and they somehow walk away unscathed despite it not being the likley outcome	214	1	against all odds
-0.3213193118572235	0	0	I dunno, what's the opportunity cost in the long run?	I dunno, what's the opportunity cost in the lengthy jog?	454	0	in the long run
0.3914932608604431	0	0	However, once Cyanogenmod is up and running, we might be able to use it!	However, once Cyanogenmod is up and moving, we might be able to use it!	84	0	up and running
1.3811451196670532	1	1	Makes my morning shit a race against the clock	Makes my morning shit a busy race	77	0	against the clock
0.4868048429489136	0	0	Hormones are all over the place after you give birth, and lactation hormones in particular are a libido killer	Hormones are all over the point after you give birth, and lactation hormones in particular are a libido killer	477	0	all over the place
0.14155790209770203	0	0	Canada and health plan so it costs me $5 out of pocket every 10 days	Canada and health plan so it costs me $5 out of sack every 10 days	449	0	out of pocket
0.1896842122077942	0	0	There are plenty of LE trade-ins out there that won't break the bank	There are plenty of LE trade-ins out there that won't cut short the riverbank	141	0	break the bank
0.21374601125717163	0	0	There are plenty of LE trade-ins out there that won't break the bank	There are plenty of LE trade-ins out there that won't end the slope	141	0	break the bank
0.5743358731269836	1	1	That distance could be physical (moving out), or it could be emotional -- best thing you can do? Stop letting her use your shoulder to cry on	That distance could be physical (moving out), or it could be emotional -- best thing you can do? Stop letting supporting her emotionally	271	1	shoulder to cry on
0.4800368845462799	0	0	Way to set the bar on this one	Way to set the club on this one	346	1	set the bar
0.3767782151699066	0	1	Is your devotion to your team *that* stringent that you're willing to stick by it even in the face of serious injury to another player?	Is your devotion to your team *that* stringent that you're willing to stick by it even in front of serious injury to another player?	414	0	in the face of
0.2787570655345917	0	0	You assume this option is off the table in real life	You assume this option is off the array in real life	139	0	off the table
-0.08238115906715393	0	0	oh by all means	oh by all implementation	37	0	by all means
-0.32528164982795715	0	0	You want someone who doesn't change their opinion in the face of new information?	You want someone who doesn't change their opinion in the countenance of new information?	167	0	in the face of
0.599527895450592	1	1	It would make things more intuitive for people who don't know about sister sizing, but I think it would do much more good to do some sort of information campaign to get the word out and teach people about bra sizing (and maybe find a way to reduce letter-phobia)	It would make things more intuitive for people who don't know about sister sizing, but I think it would do much more good to do some sort of information campaign to inform the public and teach people about bra sizing (and maybe find a way to reduce letter-phobia)	340	1	get the word out
0.6554248332977295	1	1	"Still makes me go ""holy shit it really is impressive"" from time to time when I see 40 or 50 people running around without being necesarily involved with what I do"	"Still makes me go ""holy shit it really is impressive"" occasionally when I see 40 or 50 people running around without being necesarily involved with what I do"	478	0	from time to time
0.6536678075790405	1	1	I think you hit the nail on the head of my experience with Best Buy people pointing to the fine print of the contract (or rather, it's on the medium sized print but not on the advertised concept)	I think you excelled of my experience with Best Buy people pointing to the fine print of the contract (or rather, it's on the medium sized print but not on the advertised concept)	138	0	hit the nail on the head
0.3835762143135071	0	1	I ended up taking it back to the Apple store and they swapped it out for a new one on the spot because it was under warranty	I ended up taking it back to the Apple store and they swapped it out for a new one right then and there because it was under warranty	213	1	on the spot
0.935073971748352	1	1	I've got records that run the gamut, though	I've got records of all kinds, though	374	1	run the gamut
0.3592303991317749	0	0	Leave it to the baby boomers to take a world where one could pay for college by working a part time summer job, and turn it into a world where two parents with full time jobs can't make ends meet	Leave it to the baby boomers to take a world where one could pay for college by working a part time summer job, and turn it into a world where two parents with full time jobs can't make ends intersect	416	0	make ends meet
0.4813351631164551	0	0	Just keep a stiff upper lip and drive on	Just keep a soft upper lip and drive on	217	1	stiff upper lip
0.3209119737148285	0	0	Somewhere down the road, yes	Somewhere down the access road, yes	120	0	down the road
1.3014500141143799	1	1	Yes, they might be late from time to time	Yes, they might be late sometimes	444	0	from time to time
0.1996806561946869	0	0	I don't market, rely on word of mouth and usually sell only to my friends and a very few people on the side and I am able to sell them the most common TLDs for $10	I don't market, rely on language unit of lips and usually sell only to my friends and a very few people on the side and I am able to sell them the most common TLDs for $10	419	0	word of mouth
0.6837795376777649	1	1	Glad you're here, and happy to see some activity in this subreddit! My extended family hasn't been told, but I'm sure they can put two and two together	Glad you're here, and happy to see some activity in this subreddit! My extended family hasn't been told, but I'm sure they can guess whats going on	281	1	put two and two together
0.3842984139919281	0	0	Compare 8g of thorium (once it's being mined and refined on a scale to support general vehicle use) to 7500 gal of gasoline at the prices anticipated for 2014 (when the prototype is expected to be up and running)	Compare 8g of thorium (once it's being mined and refined on a scale to support general vehicle use) to 7500 gal of gasoline at the prices anticipated for 2014 (when the prototype is expected to be up and travel rapidly)	86	0	up and running
0.7480124235153198	1	0	Thats when I wake up in a jolt with my heart rate through the roof hoping I'm actually awake, not dreaming I'm awake	Thats when I wake up in a jold with my heart rate behaving regularly hoping I'm actually awake, not dreaming I'm awake	261	1	through the roof
0.722626268863678	1	1	What I mean by that is life will throw some terrible shit at you from time to time	What I mean by that is life will throw some terrible shit at you occasionally	464	0	from time to time
0.6818680763244629	1	1	Microsoft on the other hand present a simple system which can be customised	Microsoft from a different point of view present a simple system which can be customised	437	0	on the other hand
0.346532940864563	0	1	It's tempting to just skip ahead to the simplified, but trust me, the harder way will be better for you in the long run if you really want to be literate	It's tempting to just skip ahead to the simplified, but trust me, the harder way will be better for you in the distant future if you really want to be literate	429	0	in the long run
0.354828417301178	0	1	First of all, I would say that what occurs between couples behind closed doors might not be what you are actually seeing	First of all, I would say that what occurs between couples outside of public view might not be what you are actually seeing	350	1	behind closed doors
0.6225554347038269	1	1	Even if he gave you shit for it, you'd still have breakouts from time to time	Even if he gave you shit for it, you'd still have breakouts sometimes	52	0	from time to time
1.2368885278701782	1	1	That happens from time to time anyway	That happens sometimes anyway	54	0	from time to time
0.20053404569625854	0	0	Must be a slap in the face to those who complain about suggestions xD	Must be punch in the head to those who complain about suggestions xD	276	1	slap in the face
0.09170058369636536	0	0	*Lost Highway*, on the other hand, I have no idea what's going on there	*Lost Highway*,  on the alternative leg, I have no idea what's going on there	417	0	on the other hand
0.4108514189720154	0	0	The AAV on the other hand is meant to transport marines from the sea to the shore and onward	The AAV on the alternative arm is meant to transport marines from the sea to the shore and onward	175	0	on the other hand
0.7177404165267944	1	1	Don't you know? 63% statistics are made up right on the spot!	Don't you know? 63% statistics are made up right when they are presented!	328	1	on the spot
0.7691806554794312	1	1	I just got flashbacks from when I came face to face with one in front of my apartment	I just got flashbacks from when I came in direct contact with one in front of my apartment	335	1	face to face
0.6114339232444763	1	0	With bells and whistles like a full gaming mouse and keyboard + a great sound system, that still wouldn't take us over $1100	With acoustic device and sound like a full gaming mouse and keyboard + a great sound system, that still wouldn't take us over $1100	168	0	bells and whistles
0.4068969786167145	0	0	A two-back offense is just not in the cards, unless you count Vick as a back alongside McCoy	A two-back offense is just not in the entertainment, unless you count Vick as a back alongside McCoy	59	0	in the cards
0.687344491481781	1	1	Years down the road, the world won't have room for them all, and it's going to be a very uncomfortable place	Years after, the world won't have room for them all, and it's going to be a very uncomfortable place	109	0	down the road
-0.19647064805030823	0	0	Only a matter of time	Only a concern of case	43	0	matter of time
0.6569546461105347	1	1	I dunno, what's the opportunity cost in the long run?	I dunno, what's the opportunity cost in the long term?	454	0	in the long run
0.6362151503562927	1	1	these straw polls are a dime a dozen, with a different victor in each poll	these straw polls are a common place, with a different victor in each poll	68	0	dime a dozen
1.022216558456421	1	1	This is the same conversation that comes up again and again	This is the same conversation that comes up repeatedly	285	1	again and again
0.13285061717033386	0	0	these straw polls are a dime a dozen, with a different victor in each poll	these straw polls are a dime a large integer, with a different victor in each poll	68	0	dime a dozen
0.5391797423362732	1	0	If they ever sell this in the US, I'll buy one one in a heartbeat	If they ever sell this in the US, I'll buy one one in a periodic event	432	0	in a heartbeat
